{
 "$schema": "https://json-schema.org/draft/2020-12/schema",
 "additionalProperties": false,
 "properties": {
  "anomaly_end": {
   "type": "integer"
  },
  "anomaly_start": {
   "type": "integer"
  },
  "channel_range": {
   "additionalProperties": false,
   "properties": {
    "bed1": {
     "items": {
      "type": "number"
     },
     "maxItems": 2,
     "minItems": 2,
     "type": "array"
    },
    "bed2": {
     "items": {
      "type": "number"
     },
     "maxItems": 2,
     "minItems": 2,
     "type": "array"
    },
    "bfo1": {
     "items": {
      "type": "number"
     },
     "maxItems": 2,
     "minItems": 2,
     "type": "array"
    },
    "bfo2": {
     "items": {
      "type": "number"
     },
     "maxItems": 2,
     "minItems": 2,
     "type": "array"
    },
    "bso1": {
     "items": {
      "type": "number"
     },
     "maxItems": 2,
     "minItems": 2,
     "type": "array"
    },
    "bso2": {
     "items": {
      "type": "number"
     },
     "maxItems": 2,
     "minItems": 2,
     "type": "array"
    },
    "bso3": {
     "items": {
      "type": "number"
     },
     "maxItems": 2,
     "minItems": 2,
     "type": "array"
    },
    "ced1": {
     "items": {
      "type": "number"
     },
     "maxItems": 2,
     "minItems": 2,
     "type": "array"
    },
    "cfo1": {
     "items": {
      "type": "number"
     },
     "maxItems": 2,
     "minItems": 2,
     "type": "array"
    },
    "cso1": {
     "items": {
      "type": "number"
     },
     "maxItems": 2,
     "minItems": 2,
     "type": "array"
    }
   },
   "required": [
    "bed1",
    "bed2",
    "bfo1",
    "bfo2",
    "bso1",
    "bso2",
    "bso3",
    "ced1",
    "cfo1",
    "cso1"
   ],
   "type": "object"
  },
  "channels_u16": {
   "additionalProperties": false,
   "properties": {
    "bed1": {
     "pattern": "^[A-Za-z0-9+/]*={0,2}$",
     "type": "string"
    },
    "bed2": {
     "pattern": "^[A-Za-z0-9+/]*={0,2}$",
     "type": "string"
    },
    "bfo1": {
     "pattern": "^[A-Za-z0-9+/]*={0,2}$",
     "type": "string"
    },
    "bfo2": {
     "pattern": "^[A-Za-z0-9+/]*={0,2}$",
     "type": "string"
    },
    "bso1": {
     "pattern": "^[A-Za-z0-9+/]*={0,2}$",
     "type": "string"
    },
    "bso2": {
     "pattern": "^[A-Za-z0-9+/]*={0,2}$",
     "type": "string"
    },
    "bso3": {
     "pattern": "^[A-Za-z0-9+/]*={0,2}$",
     "type": "string"
    },
    "ced1": {
     "pattern": "^[A-Za-z0-9+/]*={0,2}$",
     "type": "string"
    },
    "cfo1": {
     "pattern": "^[A-Za-z0-9+/]*={0,2}$",
     "type": "string"
    },
    "cso1": {
     "pattern": "^[A-Za-z0-9+/]*={0,2}$",
     "type": "string"
    }
   },
   "required": [
    "bed1",
    "bed2",
    "bfo1",
    "bfo2",
    "bso1",
    "bso2",
    "bso3",
    "ced1",
    "cfo1",
    "cso1"
   ],
   "type": "object"
  },
  "encoding": {
   "type": "string"
  },
  "id": {
   "type": "string"
  },
  "labels_u8": {
   "pattern": "^[A-Za-z0-9+/]*={0,2}$",
   "type": "string"
  },
  "n": {
   "type": "integer"
  },
  "row0": {
   "type": "integer"
  },
  "schema_version": {
   "const": "v1"
  },
  "scores_q_u16": {
   "additionalProperties": false,
   "properties": {
    "pca": {
     "pattern": "^[A-Za-z0-9+/]*={0,2}$",
     "type": "string"
    }
   },
   "required": [
    "pca"
   ],
   "type": "object"
  },
  "seconds": {
   "items": {
    "type": "integer"
   },
   "maxItems": 2,
   "minItems": 2,
   "type": "array"
  },
  "source_window": {
   "type": "string"
  },
  "tags": {
   "additionalProperties": {
    "pattern": "^(OBSERVED|DERIVED|PREDICTED|SIMULATED|SYNTHETIC)(/(OBSERVED|DERIVED|PREDICTED|SIMULATED|SYNTHETIC))*$",
    "type": "string"
   },
   "minProperties": 1,
   "type": "object"
  }
 },
 "required": [
  "schema_version",
  "tags",
  "id",
  "source_window",
  "row0",
  "n",
  "seconds",
  "anomaly_start",
  "anomaly_end",
  "encoding",
  "labels_u8",
  "channels_u16",
  "channel_range",
  "scores_q_u16"
 ],
 "title": "window_hero",
 "type": "object"
}
