{"anomaly_end":1200,"anomaly_start":300,"channel_range":{"bed1":[-8.488070487976074,16.77479362487793],"bed2":[-4.6753458976745605,10.149064064025879],"bfo1":[-117.55878448486328,780.3936157226562],"bfo2":[-172.09375,1306.2567138671875],"bso1":[-89.5602798461914,129.02537536621094],"bso2":[-11.261865615844727,34.513702392578125],"bso3":[-1.4568825960159302,8.804987907409668],"ced1":[-808.0387573242188,6354.1982421875],"cfo1":[-156.03713989257812,127.56649780273438],"cso1":[-203.03143310546875,296.1995544433594]},"channels_u16":{"bed1":"tlylXJRchFxzXGJcUlxCXDJcIlwSXANc9FvkW9Vbxlu4W6lbm1uMW35bcFtiW1RbR1s5W05lSW8Ib8huiW5Kbgxuzm2SbVVtGm3ebKRsamwxbPhrwGuIa1FrGmvkaq9qempGahJq3mmsaXlpR2kWaeVotWiFaFZoJ2j4Z8pnnWdwZ0NnF2frZsBmlWZrZkFmF2buZcVlnWV1ZU5lJmUAZdlks2SOZGhkRGQfZPtj12O0Y5FjkG1UbRht3WyjbGlsL2z3a75rh2tQaxlr42quanlqRGoRat1pqml4aUZpFWnkaLRohGhVaCZo92fJZ5xnb2dCZxZn6ma/ZpRmamZAZjhw9W+zb3FvMG/wbrBucW4ybvRtt216bT5tA23IbI5sVGwbbOJrqmtzazxrBWvQappqZmoyav5py2mYaWZpNGkDadNoomhzaERoFWjnZ7lni2dfZzJnBmfbZq9mhWZbZjFmB2beZbZljmVmZT5lF2XxZMtkpWR/ZFpkNWQRZO1jyWOmY4NjYWM/Yx1j+2LaYrlimWJ4YlhiOWIaYvth3GG+YaBhgmFkYUdhK2EOYfJg1mC6YJ9gg2BpYE5gNGAZYABg5l/NX7Rfm1+CX2pfUl86XyNfC1/0Xt1ex16wXppehF5uXlleQ14uXhleBV7wXdxdyF20XaBdjV15XWZdU11BXS5dHF0KXfhc5lzUXMNcsVygXI9cf1xuXF5cTVw9XC1cHVwOXP5b71vgW9FbwluzW6VblluIW3pbbFteW1BbQ1s1WyhbG1sOWwFb9FroWttaz1rCWrZaqlqeWpJah1p7WnBaZFpZWk5aQ1o4Wi5aI1oYWg5aA1r5We9Z5VnbWdFZyFm+WbRZq1nEY6BjfmNbYzljF2P2YtRi1mybbGJsKGzwa7drgGtJaxJr3WqnanJqPmoKatdppGlyaUBpD2neaK5ofmhPaCBo8mfEZ5ZnaWc9ZxFn5Wa6Zo9mZWY7ZhFm6GW/ZZdlb2VIZSFl+mTUZK5kiGRjZD5kGmT2Y9Jjr2OMY2ljR2MlYwNj4mLBYqBigGJgYkBiIWICYuNhxWGnYYlhbGFOYTFhFWH4YNxgwWClYIpgb2BUYDpgIGAGYOxf01+6X6FfiF9wX1hfQF8oXxFf+l7jXsxetV6fXolec15eXkheM14eXgle9V3hXcxduV2lXZFdfl1rXVhdRV0yXSBdDl38XOpc2FzHXLVcpFyTXINcclxhXFFcQVwxXCFcElwCXPNb5FvUW8Zbt1uoW5pbi1t9W29bYVtUW0ZbOVsrWx5bEVsEW/da61reWtJaxVq5Wq1aoVqVWopaflpzWmdaXFpRWkZaO1owWiVaG1oQWgZa/FnyWedZ3VnUWcpZwFm3Wa1ZpFmaWZFZiFl/WXZZbVllWVxZU1lLWUNZOlkyWSpZIlkaWRJZClkCWftY81jsWORY3VjVWM5Yx1jAWLlYslirWKRYnliXWJBYiliDWH1Yd1hwWGpYZFheWHpiWmI6Yhti/GHeYb9hoWGDYWZhSWEsYQ9h82DXYLtgoGCFYGpgT2A1YBtgAWDnX85ftV+cX4Rfa19TXztfJF8MX/Ve3l7IXrFem16FXm9eWl5EXi9eGl4GXvFd3V3JXbVdoV2OXXpdZ11UXUJdL10dXQpd+FznXNVcxFyyXKFckFx/XG9cXlxOXD5cLlweXA9c/1vwW+Fb0lvDW7RbpluXW4lbe1ttW19bUVtEWzZbS2UkZf1k12SxZItkZmRBZB1k+WPVY7FjjmNsY0ljJ2MGY+VixGKjYoNiY2JDYiRiJ2zua7ZrfmtHaxFr22qmanFqPWoJatVpo2lwaT9pDmndaK1ofWhNaB9o8GfCZ5VnaGc7Zw9n5Ga5Zo5mY2Y5ZhBm52W+ZZZlbmVHZSBl+WTTZK1kh2RiZD1kGWT1Y9FjrmOLY2hjRmMkYwJj4WLAYp9if2JfYj9iIGIBYuJhxGGmYYhha2FNYTFhFGH4YNxgwGCkYIlgbmBUYDlgH2AFYOtf0l+5X6BfiF9vX1dfP18oXxBf+V7iXstetV6fXolec15dXkheM14eXgle9F3gXcxduF2kXZFdfV1qXVddRF0yXSBdDV37XOlc2FzGXLVcpFyTXIJccVxhXFFcQVwxXCFcEVwCXPJb41vUW8VbtluoW5lbi1t9W29bYVtTW0ZbOFsrWx5bEVsEW/da6lreWtFaxVq5Wq1aoVqVWolaflpyWmdaXFpQWkVaO1owWiVaGloQWgZa+1nxWedZ3VnTWcpZwFm2Wa1Zo1maWZFZiFl/WXZZbVlkWVxZU1lLWUJZOlkyWSpZIlkaWRJZClkCWfpY81jrWORY3VjVWM5Yx1jAWLlYslirWKRYnViXWJBYiliDWH1YdlhwWGpYZFheWFhYUlhMWEZYQFg6WDVYL1gqWCRYH1gZWBRYD1gJWARY/1f6V/VX8FfrV+ZX4VfdV9hX01fPV8pXxVfBV7xXuFe0V69Xq1enV6NXnleaV5ZXklewYZJhdWFYYTthHmEBYeVgyWCuYJNgd2BdYEJgKGAOYPRf21/CX6lfkF94X19fR18wXxhfAV/qXtNevV6mXpBeel5lXk9eOl4lXhBe+13nXdNdv12rXZddhF1xXV5dS104XSZdFF0CXfBc3lzMXLtcqlyZXIhcd1xnXFZcRlw2XCZcF1wHXPhb6FvZW8pbvFutW55bkFuCW3RbZltYW0pbPVsvWyJbFVsIW/ta71riWtZayVq9WrFapVqZWo1aglp2WmtaX1pUWklaPlozWilaHloUWgla/1n1WetZ4VnXWc1Zw1m6WbBZp1mdWZRZi1mCWXlZcFlnWV9ZVllOWUVZPVk1WSxZJFkcWRRZDVkFWf1Y9VjuWOZY31jYWNBYyVjCWLtYtFitWKdYoFiZWJJYjFiFWH9YeVhyWGxYZlhgWFpYVFhOWEhYQlg8WDdYMVgsWCZYIVgbWBZYEFgLWAZYAVj8V/dX8lftV+hX41feV9lX1VfQV8xXx1fCV75Xule1V7FXrFeoV6RXoFecV5hXlFeQV4xXiFeEV4BXfFd4V3VXcVdtV2pXZldjV19XXFdYV1VXUVdOV0tXR1dEV0FXPlc7VzhXNFcxVy5XK1coVyVXI1cgVx1XGlcXVxRXElcPVwxXClcHVwRXAlf/Vv1W+lb4VvVW81YTYfZg2mC/YKNgiGBtYFJgOGAeYARg","bed2":"xVDFUMRQxFDDUMNQw1DCUMJQwlDCUMFQwVDBUMFQwFDAUMBQwFDAUMBQv1C/UL9Qv1C/UARia3K8cCJvnW0sbM1qf2lCaBVn92XnZOVj8GIHYiphV2CQX9JeHl5yXdBcNVyiWxdbkloUWp1ZK1m/WFlY91ebV0NX71agVlVWDVbJVYhVS1URVdlUpVRzVENUFlTrU8JTnFN3U1RTM1MTU/VS2VK+UqRSjFJ1Ul9SSlI2UiNSVmNoYoZhr2DjXyFfaV66XRNddVzfW1FbyVpJWs9ZWlnsWINYIFjBV2dXElfBVnRWK1blVaNVZVUpVfBUulSHVFdUKVT9U9NTrFOGU6dkqGO2YtBh9WAmYGFfpV7zXUpdqVwRXIBb9lpzWvdZgVkQWaZYQVjgV4VXLlfcVo1WQ1b8VblVeVU9VQNVzFSYVGdUOFQLVOFTuVOTU25TTFMrUwxT7lLSUrhSnlKGUm9SWlJFUjFSH1INUvxR7FHdUc9RwVG0UadRnFGRUYZRfFFyUWlRYVFYUVFRSVFCUTtRNVEvUSlRJFEfURpRFVERUQ1RCVEFUQFR/lD6UPdQ9FDyUO9Q7FDqUOhQ5lDkUOJQ4FDeUNxQ21DZUNhQ1lDVUNRQ01DSUNFQ0FDPUM5QzVDMUMtQy1DKUMlQyVDIUMdQx1DGUMZQxVDFUMRQxFDEUMNQw1DDUMJQwlDCUMJQwVDBUMFQwVDAUMBQwFDAUMBQwFC/UL9Qv1C/UL9Qv1C/UL9QvlC+UL5QvlC+UL5QvlC+UL5QvlC+UL5QvlC+UL1QvVC9UL1QvVC9UL1QvVC9UL1QvVC9UL1QvVC9UL1QvVC9UL1QvVC9UL1QvVC9UL1QvVC9UL1QvVABYiRhUmCLX81eGV5uXcxcdm0HbKlqXWkiaPdm2mXMZMtj12LvYRNhQmB7X79eC15hXb9cJlyTWwlbhVoIWpFZIFm0WE5Y7VeRVzpX51aYVk1WBlbCVYJVRVULVdRUn1RuVD5UEVTnU75TmFNzU1BTL1MQU/JS1lK7UqJSiVJyUlxSSFI0UiFSD1L+Ue5R31HQUcNRtlGpUZ1RklGHUX1RdFFqUWJRWVFSUUpRQ1E8UTZRMFEqUSVRH1EbURZREVENUQlRBVECUf5Q+1D4UPVQ8lDvUO1Q6lDoUOZQ5FDiUOBQ3lDdUNtQ2VDYUNdQ1VDUUNNQ0lDRUNBQz1DOUM1QzFDLUMtQylDJUMlQyFDHUMdQxlDGUMVQxVDFUMRQxFDDUMNQw1DCUMJQwlDCUMFQwVDBUMFQwFDAUMBQwFDAUMBQv1C/UL9Qv1C/UL9Qv1C/UL5QvlC+UL5QvlC+UL5QvlC+UL5QvlC+UL5QvlC9UL1QvVC9UL1QvVC9UL1QvVC9UL1QvVC9UL1QvVC9UL1QvVC9UL1QvVC9UL1QvVC9UL1QvVC9UL1QvVC9UL1QvVC9UL1QvVC9UL1QvVC9UL1QvVC9UL1QvVC9UL1QvVC9UL1QvVC9UAFiJGFSYItfzV4ZXm5dzFwxXJ9bE1uPWhFamlkoWb1YVlj1V5lXQVftVp5WU1YLVsdVh1VKVQ9V2FSjVHFUQlQVVOpTwVObU3ZTU1MyUxNT9VLYUr1SpFKLUnRSXlJJUjVSI1IRUgBS8FHgUdJRxFG3UapRnlGTUYhRflF0UWtRYlFaUVJRS1FEUT1RNlEwUStRJVEgURtRFlESUQ1RCVEGUQJR/lD7UPhQ9VDyUPBQMmJSYX5gtF/1Xj9ekl3uXFFcvVswW6taLFqzWUBZ01hsWAlYrFdTV/9Wr1ZiVhpWGmf8Zexk6mP0YgtiLWFbYJNf1V4hXnVd0lw4XKVbGVuVWhdan1ktWcFYWlj5V5xXRFfxVqFWVlYOVspViVVMVRJV2lSmVHNURFQXVOxTw1OcU3hTVVMzUxRT9lLZUr5SpVKMUnVSX1JKUjZSI1IRUgBS8FHhUdJRxFG3UatRn1GTUYlRflF1UWxRY1FaUVNRS1FEUT1RN1ExUStRJVEgURtRFlESUQ5RClEGUQJR/1D7UPhQ9VDyUPBQ7VDrUOhQ5lDkUOJQ4FDeUN1Q21DaUNhQ11DVUNRQ01DSUNFQ0FDPUM5QzVDMUMtQy1DKUMlQyVDIUMhQx1DGUMZQxVDFUMVQxFDEUMNQw1DDUMJQwlDCUMJQwVDBUMFQwVDAUMBQwFDAUMBQwFC/UL9Qv1C/UL9Qv1C/UL9QvlC+UL5QvlC+UL5QvlC+UL5QvlC+UL5QvlC+UL1QvVC9UL1QvVC9UL1QvVC9UL1QvVC9UL1QvVC9UL1QvVC9UL1QvVC9UL1QvVC9UL1QvVC9UL1QvVC9UL1QvVC9UL1QvVC9UL1QvVC9UL1QvVC9UL1QvVC9UL1QvVC9UL1QvVC9UL1QvVC9UL1QvVC9UL1QvVC9UL1QvVC9UL1QvVC9UL1QvVC9UL1QvVC9UL1QvVC9UL1QvVC9UL1QvVC9UL1QvVC9UL1QvVC9UL1QvVC9UL1QvVC9UL1QvVABYiRhUmCLX81eGV5uXcxcMVyfWxNbj1oRWppZKFm9WFZY9VeZV0FX7VaeVlNWC1bHVYdVSVUPVdhUo1RxVEJUFVTqU8FTm1N2U1NTMlMTU/VS2FK9UqRSi1J0Ul5SSVI1UiNSEVIAUvBR4FHSUcRRt1GqUZ5Rk1GIUX5RdFFrUWJRWlFSUUtRRFE9UTZRMFErUSVRIFEbURZRElENUQlRBlECUf5Q+1D4UPVQ8lDwUO1Q61DoUOZQ5FDiUOBQ3lDdUNtQ2lDYUNdQ1VDUUNNQ0lDRUNBQz1DOUM1QzFDLUMtQylDJUMlQyFDHUMdQxlDGUMVQxVDFUMRQxFDDUMNQw1DCUMJQwlDCUMFQwVDBUMFQwFDAUMBQwFDAUMBQv1C/UL9Qv1C/UL9Qv1C/UL5QvlC+UL5QvlC+UL5QvlC+UL5QvlC+UL5QvlC9UL1QvVC9UL1QvVC9UL1QvVC9UL1QvVC9UL1QvVC9UL1QvVC9UL1QvVC9UL1QvVC9UL1QvVC9UL1QvVC9UL1QvVC9UL1QvVC9UL1QvVC9UL1QvVC9UL1QvVC9UL1QvVC9UL1QvVC9UL1QvVC9UL1QvVC9UL1QvVC9UL1QvVC9UL1QvVC9UL1QvVC9UL1QvVC9UL1QvVC9UL1QvVC9UL1QvVC9UL1QvVC9UL1QvVABYiRhUmCLX81eGV5uXcxcMVyfWxNb","bfo1":"hiGGIYYhhiGGIYYhhiGGIYYhhiGGIYYhhiGFIYUhhSGFIYUhhSGFIYUhhSGFIYUhhSGFIYUhhSGFIYUhhSGFIYUhhSGFIYUhhSGFIYUhhSGFIYUhhSGFIYUhhSGFIYUhhSGFIYUhhSGFIYUhhSGFIYQhhCGEIYQhhCGEIYQhhCGEIYQhhCGEIYQhhCGEIYQhhCGEIYQhhCGEIYQhhCGEIYQhhCGEIYQhhCGEIYQhhCGEIYQhhCGEIYQhhCGEIYQhhCGEIYQhhCGEIYQhhCGEIYQhhCGEIYQhhCGEIYQhhCGEIYQhhCGEIYQhhCGEIYQhhCGEIYQhhCGEIYQhhCGEIYQhhCGEIYQhhCGEIYQhhCGEIYQhhCGEIYQhhCGEIYQhhCGEIYQhhCGEIYQhhCGEIYQhhCGEIYQhhCGEIYQhhCGEIYQhhCGEIYQhhCGEIYQhhCGEIYQhkyGiIbEhvyHOIdwh6iH4IQUiEyIgIi0iOiJHIlQiYCJtInkihSKQIpwipyKxIrsixCLNItYi4CLpIvEi+iICIwsjEyMbIyIjKiMxIzkjQCNGI00jUyNZI2AjZiNsI3IjdyN9I4IjhiOLI48jlCOZI50joiOmI6ojriOzI7cjuyO/I8QjxyPLI88j0yPWI9oj3SPgI+Mj5yPqI+0j8CP0I/cj+iP8I/4jACQDJAUkByQJJAskDSQQJBIkFCQXJBkkGyQdJCAkIiQlJCckKSQsJC4kMSQzJDYkOCQ6JDwkPiRAJEEkQyRFJEYkSCRKJEwkTSRPJFEkUyRUJFYkWCRaJFskXSRgJGIkZCRmJGgkaSRqJGwkbSRvJHAkcSRiJFMkRSQ3JCokHCQPJAIk9SPpI+wj7iPwI/Ij9SP3I/kj+yP+IwAkAiQEJAYkCCQJJAskDSQOJBAkEiQTJBUkFyQZJBokHCQeJCAkIiQjJCUkJyQoJCokKyQtJC8kMCQyJDMkNSQ3JDkkOyQ9JD4kQCRCJEQkRiRHJEkkSyRMJE4kTyRQJFEkUiRTJFQkVSRWJFckWCRZJFokWyRcJFwkXSReJF8kXyRfJGAkYCRgJGAkYCRgJGAkYCRgJGAkYCRgJGAkYCRgJGAkYCRhJGEkYiRiJGMkZCRkJGUkZiRmJGckZyRoJGgkaSRpJGokayRrJGwkbSRuJG8kcCRxJHIkcyR0JHYkdyR4JHkkeSR6JHskfCR8JH0kfSR+JH4kfyR/JIAkgSSBJIIkgiSCJIMkhCSFJIYkhySIJIkkiSSKJIskjCSNJI4kjySQJJEkkiSTJJQklCSUJJUklSSVJJYklySXJJgkmCSZJJkkmSSaJJokmySbJJskmySbJJokmiSaJJkkmSSYJJgklySXJJYkliSVJJUklSSUJJQkkySSJJIkkSSRJJAkkCSQJI8kjySOJI4kjiSNJI0kjCSLJIskiySKJIokiSSJJIgkhySGJIYkhSSEJIQkhCSDJIMkgySCJIIkgSSBJIAkgCR/JH4kfiR9JH0kfCR8JHskeyR7JHskeyR7JHskeyR7JHskeyR7JHskeyR7JHskeyR7JHokeiR6JHkkeSR4JHgkeCR3JHckdyR2JHYkdiR2JHYkdiR2JHYkdiR2JHckdyR3JHckdyR3JHgkeCR5JHokeiR6JHskeyR8JH0kfSR+JH8kfyR/JH8kgCSAJIAkgSSBJIEkgiSCJIIkgiSCJHIkZCRVJEckOSQrJB4kECQDJPcj6iPeI9IjxyO7I7AjpSOaI48jhSN7I3EjZyNeI1QjSyNSI1gjXyNlI2sjcSN2I3wjgSOGI4sjkCOVI5ojniOiI6YjqyOvI7MjtyO7I74jwiPGI8ojziPRI9Uj2CPbI94j4iPlI+cj6iPtI+8j8iP0I/Yj+CP7I/0j/yMAJAIkBCQGJAgkCiQLJA0kDyQRJBMkFSQXJBokHCQeJCEkJCQmJCkkLCQvJDIkNCQ3JDkkPCQ/JEEkRCRHJEkkTCROJFAkUyRWJFgkWyRdJF8kYSRjJGUkZyRpJGokbCRtJG8kcCRyJHMkdCR2JHYkeCR5JHokeyR7JHwkfSR9JH4kfiR+JH8kfyR/JH8kfyR/JH8kfyR/JH8kfiRvJGEkUiREJDYkKCQbJA4kAST0I+gj3CPQI8QjuSOuI6MjmCONI4MjeSNvI2UjXCNSI0kjQCM3Iy8jJiMeIxYjDiMGI/4i9yLwIugi4SLaItQizSLGIsAiuiK0Iq4iqCKiIpwilyKRIowihyKCIn0ieCJzIm4iaSJlImAiXCJYIlQiTyJLIkgiRCJAIjwiOCI1IjEiLiIrIiciJCIhIh4iGyIYIhUiEiIPIgwiCiIHIgQiAiL/If0h+iH4IfYh9CHxIe8h7SHrIekh5yHlIeMh4SHfId0h3CHaIdgh1yHVIdMh0iHQIc8hzSHfIfEhAiITIiQiNCJEIlMiYiJxIoAijiKbIqgitSLCIs4i2iLmIvIi/iIJIxQjHiMoIzIjPCNFI04jVyNgI2gjcCN4I4AjiSOQI5gjoCOoI7AjuCO/I8cjzyPWI94j5SPsI/Mj+iMBJAgkDyQWJB0kJSQsJDMkOiRAJEckTSRSJFgkXSRjJGgkbiRzJHkkfySFJIokjySVJJkkniSiJKYkqySvJLMktyS7JL8kwiTFJMkkzCTPJNIk1STYJNsk3STgJOIk5CTnJOkk7CTuJPAk8iTzJPUk9iT4JPok+yT9JP8kASUDJQUlByUIJQolCyUMJQ4lDyUQJRElESUSJRMlFCUUJRUlFiUWJRclFyUXJRclFyUYJRglGCUZJRolGiUbJRslHCUdJR4lHyUgJSAlISUiJSIlIyUjJSMlIyUkJSQlJCUkJSQlJCUkJSQlJCUkJSQlJCUkJSUlJSUlJSYlJiUmJSYlJyUnJSclJyUnJSclKCUnJSclJiUmJSUlJSUkJSQlJCUkJSQlIyUjJSIlISUgJSAlHyUfJR4lHiUdJR0lHSUdJR0lHSUcJRwlHCUcJRwlHCUcJR0lHSUdJR0lHSUdJR0lHCUcJRslGyUaJRolGiUaJR